{"$id":"pe4-ha-association-independent-production-acceptance-capture-correction.schema.json","$schema":"https://json-schema.org/draft/2020-12/schema","additionalProperties":false,"properties":{"attempt_1":{"additionalProperties":false,"properties":{"adapter_executed":{"const":false},"attempt_number":{"const":1},"capture_error_code":{"const":"ACCEPTANCE_JSON_NOT_CANONICAL"},"capture_failure_stage":{"const":"CAPTURE"},"capture_result":{"const":"FAIL"},"codex_observed":{"const":false},"credential_accessed":{"const":false},"evidence_recreated":{"const":false},"execution":{"const":"COMPLETED_READ_ONLY"},"ha_network_attempted":{"const":false},"historical_failed_run_directory":{"const":"C:\\Users\\JorgeAzofeifaCastill\\AppData\\Local\\HIOC\\evidence\\pe4\\independent-acceptance\\16b7dd412cde7503ea45c62734915096654aa690\\20261007T144645-b79becafb543"},"inspection_semantic_result":{"const":"PASS"},"manifest_json_published":{"const":false},"production_mutated":{"const":false},"provenance":{"const":"OPERATOR_SUPPLIED_WINDOWS_AND_PRODUCTION_EXECUTION_EVIDENCE"},"raw_stdout_durably_available":{"const":false},"raw_stdout_revalidation":{"const":"UNAVAILABLE"},"remote_return_code":{"const":0},"remote_stderr_present":{"const":false},"sanitized_stdout_bytes_observed":{"const":560},"scheduler_mutated":{"const":false},"second_adapter_execution_authorized":{"const":false},"ssh_stderr_discarded":{"const":false},"validation_json_published":{"const":false}},"required":["adapter_executed","attempt_number","capture_error_code","capture_failure_stage","capture_result","codex_observed","credential_accessed","evidence_recreated","execution","ha_network_attempted","historical_failed_run_directory","inspection_semantic_result","manifest_json_published","production_mutated","provenance","raw_stdout_durably_available","raw_stdout_revalidation","remote_return_code","remote_stderr_present","sanitized_stdout_bytes_observed","scheduler_mutated","second_adapter_execution_authorized","ssh_stderr_discarded","validation_json_published"],"type":"object"},"diagnosis":{"additionalProperties":false,"properties":{"first_difference_zero_based":{"const":550},"lost_attempt_bytes_used":{"const":false},"powershell_51_synthetic_bytes":{"const":565},"powershell_51_version":{"const":"5.1.26100.9444"},"powershell_7_synthetic_equal":{"const":true},"powershell_7_version":{"const":"7.6.5"},"powershell_byte":{"const":92},"powershell_sequence":{"const":"\\u0026"},"provenance":{"const":"CODEX_OBSERVED_SYNTHETIC_LOCAL_ONLY"},"python_byte":{"const":38},"python_synthetic_bytes":{"const":560},"root_cause":{"const":"WINDOWS_POWERSHELL_5_1_CONVERT_TO_JSON_HTML_ESCAPES_AMPERSAND_AS_BACKSLASH_U0026_PYTHON_DOES_NOT"},"scope":{"const":"DETERMINISTIC_SERIALIZER_DEFECT_REPRODUCTION_NOT_RECOVERY_OF_HISTORICAL_STDOUT"}},"required":["first_difference_zero_based","lost_attempt_bytes_used","powershell_51_synthetic_bytes","powershell_51_version","powershell_7_synthetic_equal","powershell_7_version","powershell_byte","powershell_sequence","provenance","python_byte","python_synthetic_bytes","root_cause","scope"],"type":"object"},"historical_original_limitation":{"additionalProperties":false,"properties":{"disappearance_cause":{"const":"UNKNOWN"},"execution_time_comparison_recreated":{"const":false},"historical_evidence_recreated":{"const":false},"limitation":{"const":"RECORDED"},"present":{"const":false},"revalidation":{"const":"UNAVAILABLE"}},"required":["disappearance_cause","execution_time_comparison_recreated","historical_evidence_recreated","limitation","present","revalidation"],"type":"object"},"lifecycle":{"additionalProperties":false,"properties":{"attempt_1":{"const":"FAIL_DURABLE_CAPTURE"},"attempt_2":{"const":"NOT_STARTED_PREPARED_FOR_SEPARATE_AUTHORIZATION"},"capture_correction":{"const":"PASS_CLOSED"},"durable_evidence":{"const":"NOT_PUBLISHED"},"independent_production_acceptance":{"const":"NOT_CLOSED"},"inspection_portion":{"const":"PASS_OPERATOR_SUPPLIED"},"pe4":{"const":"NOT_COMPLETE"},"phase7a":{"const":"ACTIVE"},"preparation":{"const":"PASS_CLOSED"},"projection":{"const":"DEFERRED"},"rollback":{"const":"NOT_PERFORMED"},"scheduler":{"const":"NOT_STARTED"},"second_adapter_execution_authorized":{"const":false}},"required":["attempt_1","attempt_2","capture_correction","durable_evidence","independent_production_acceptance","inspection_portion","pe4","phase7a","preparation","projection","rollback","scheduler","second_adapter_execution_authorized"],"type":"object"},"negative_evidence_by_codex":{"additionalProperties":false,"properties":{"acceptance_execution":{"const":false},"adapter_execution":{"const":false},"credential_access":{"const":false},"evidence_recreation":{"const":false},"ha_access":{"const":false},"old_evidence_directory_access":{"const":false},"pi3_access":{"const":false},"production_execution":{"const":false},"production_mutation":{"const":false},"reconciler_execution":{"const":false},"scheduler_mutation":{"const":false}},"required":["acceptance_execution","adapter_execution","credential_access","evidence_recreation","ha_access","old_evidence_directory_access","pi3_access","production_execution","production_mutation","reconciler_execution","scheduler_mutation"],"type":"object"},"parent":{"const":"369134ff77d062ba0aeebc3db98e04662f2f6fed"},"record_type":{"const":"PE4_HA_ASSOCIATION_INDEPENDENT_ACCEPTANCE_CAPTURE_CORRECTION"},"retry_policy":{"additionalProperties":false,"properties":{"attempt_2":{"const":"NOT_STARTED_PREPARED_FOR_SEPARATE_AUTHORIZATION"},"attempt_2_authorized":{"const":false},"automatic_retry":{"const":false},"basis":{"const":"PREPARATION_FORBIDS_AUTOMATIC_RETRY_NOT_SEPARATELY_REVIEWED_FRESH_READ_ONLY_ATTEMPT; SAME_INSPECTION_NO_ADAPTER_RERUN"},"old_run_reused":{"const":false},"sequence":{"items":false,"maxItems":6,"minItems":6,"prefixItems":[{"const":"SOURCE_SYNC_CORRECTION_ONLY"},{"const":"STOP_INDEPENDENT_SOURCE_REVIEW"},{"const":"VALIDATE_WORKSTATION_CAPTURE_SECURITY_DURABILITY_SYNTHETICALLY"},{"const":"SEPARATE_ATTEMPT_2_AUTHORIZATION"},{"const":"NEW_EXCLUSIVE_RUN_CAPTURE_ORIGINAL_BYTES"},{"const":"STOP_INDEPENDENT_EVIDENCE_REVIEW"}],"type":"array"}},"required":["attempt_2","attempt_2_authorized","automatic_retry","basis","old_run_reused","sequence"],"type":"object"},"schema_version":{"const":"1.0"},"sources":{"additionalProperties":false,"properties":{"docs/HIOC_MASTER_PLAN.md":{"additionalProperties":false,"properties":{"git_blob":{"const":"d5a567d476265f215510e127053d91ab66816f96"},"path":{"const":"docs/HIOC_MASTER_PLAN.md"},"sha256":{"const":"e79a651ab5912f484380c0e8f35329d5c3f220b30327b8634f503ecd41ca1833"}},"required":["git_blob","path","sha256"],"type":"object"},"governance/pe4/pe4-ha-association-durable-post-run-reconciliation-closure.json":{"additionalProperties":false,"properties":{"git_blob":{"const":"08e0e4012185315b5bb801cf8cc68bb01eff5350"},"path":{"const":"governance/pe4/pe4-ha-association-durable-post-run-reconciliation-closure.json"},"sha256":{"const":"d5bf759331e95950bb5bc5a69310dfc502ffb67572fc363208c5c592fadfe983"}},"required":["git_blob","path","sha256"],"type":"object"},"governance/pe4/pe4-ha-association-independent-production-acceptance-preparation.json":{"additionalProperties":false,"properties":{"git_blob":{"const":"d2d32ac29f579b7930795990d8d0db46dd048132"},"path":{"const":"governance/pe4/pe4-ha-association-independent-production-acceptance-preparation.json"},"sha256":{"const":"5187fd4fb18a18218e95b9c7732598738249296bfb9a9a23afdcdbd259bb16a8"}},"required":["git_blob","path","sha256"],"type":"object"},"governance/pe4/pe4-ha-association-independent-production-acceptance-preparation.schema.json":{"additionalProperties":false,"properties":{"git_blob":{"const":"747152a9eabf331788070335ce277f675a048fd3"},"path":{"const":"governance/pe4/pe4-ha-association-independent-production-acceptance-preparation.schema.json"},"sha256":{"const":"119ba39cb4fc9902a38aec10ec82aca815e3e548cbe4fc3d322337e04e653ded"}},"required":["git_blob","path","sha256"],"type":"object"}},"required":["docs/HIOC_MASTER_PLAN.md","governance/pe4/pe4-ha-association-durable-post-run-reconciliation-closure.json","governance/pe4/pe4-ha-association-independent-production-acceptance-preparation.json","governance/pe4/pe4-ha-association-independent-production-acceptance-preparation.schema.json"],"type":"object"},"starting_commit":{"const":"16b7dd412cde7503ea45c62734915096654aa690"},"starting_subject":{"const":"PE-4: prepare independent production acceptance"},"status":{"const":"PASS_CLOSED"},"workstation_helper":{"additionalProperties":false,"properties":{"canonical_validation":{"const":"PYTHON_DUMPS_SORTED_COMPACT_ASCII_NO_NAN_LF_EQUALS_ORIGINAL_DUPLICATE_KEYS_REJECTED"},"credential_access":{"const":false},"durability":{"const":"FILE_FSYNC_AND_WINDOWS_DIRECTORY_FLUSH_REQUIRED_UNSUPPORTED_OR_FAILURE_FAILS_CLOSED_NO_FALLBACK"},"input":{"const":"EXACT_ORIGINAL_RECEIVED_STDOUT_ON_BINARY_STDIN_MAX4096_REMOTE_RETURN_CODE"},"interpreter":{"const":"LOCAL_WINDOWS_CPYTHON_3_12_OR_LATER_EXPLICIT_ABSOLUTE_EXECUTABLE_NO_PYTHONPATH_I_B"},"network_access":{"const":false},"new_acceptance_inspection_tool_required":{"const":false},"new_run":{"const":"NEW_EXCLUSIVE_TIMESTAMP_RANDOM_ID_UNDER_CORRECTION_COMMIT_SECURE_WINDOWS_EVIDENCE_PARENT_NO_REUSE"},"new_workstation_capture_harness_required":{"const":true},"path":{"const":"tools/hioc-pe4-ha-association-acceptance-capture.py"},"production_access":{"const":false},"publication":{"const":"ORIGINAL_VALIDATED_BYTES_ONLY_EXCLUSIVE_VALIDATION_FILE_THEN_SHA256_LENGTH_MANIFEST_LAST_FLUSH_REOPEN_NO_OVERWRITE"},"security":{"const":"NO_REPARSE_POINTS_OPERATOR_OWNED_PROTECTED_DACL_OPERATOR_SYSTEM_ADMINISTRATORS_ONLY; APPLY_DACL_ONLY_NEW_RUN"},"sha256":{"const":"a4e5895a8422f478486003300b4953be049548bbd79693366492f6ec6966d920"},"source_binding":{"const":"CLEAN_MAIN_HEAD_ORIGIN_EXACT_CORRECTION_COMMIT_DIRECT_PARENT_SUBJECT_HELPER_GIT_BYTES_NO_FETCH"},"stderr":{"const":"DISCARD_SSH_STDERR_DO_NOT_RETAIN_RAW_PRIVATE_ERRORS"}},"required":["canonical_validation","credential_access","durability","input","interpreter","network_access","new_acceptance_inspection_tool_required","new_run","new_workstation_capture_harness_required","path","production_access","publication","security","sha256","source_binding","stderr"],"type":"object"}},"required":["attempt_1","diagnosis","historical_original_limitation","lifecycle","negative_evidence_by_codex","parent","record_type","retry_policy","schema_version","sources","starting_commit","starting_subject","status","workstation_helper"],"type":"object"}
