{"attempt_1":{"adapter_executed":false,"attempt_number":1,"capture_error_code":"ACCEPTANCE_JSON_NOT_CANONICAL","capture_failure_stage":"CAPTURE","capture_result":"FAIL","codex_observed":false,"credential_accessed":false,"evidence_recreated":false,"execution":"COMPLETED_READ_ONLY","ha_network_attempted":false,"historical_failed_run_directory":"C:\\Users\\JorgeAzofeifaCastill\\AppData\\Local\\HIOC\\evidence\\pe4\\independent-acceptance\\16b7dd412cde7503ea45c62734915096654aa690\\20261007T144645-b79becafb543","inspection_semantic_result":"PASS","manifest_json_published":false,"production_mutated":false,"provenance":"OPERATOR_SUPPLIED_WINDOWS_AND_PRODUCTION_EXECUTION_EVIDENCE","raw_stdout_durably_available":false,"raw_stdout_revalidation":"UNAVAILABLE","remote_return_code":0,"remote_stderr_present":false,"sanitized_stdout_bytes_observed":560,"scheduler_mutated":false,"second_adapter_execution_authorized":false,"ssh_stderr_discarded":false,"validation_json_published":false},"diagnosis":{"first_difference_zero_based":550,"lost_attempt_bytes_used":false,"powershell_51_synthetic_bytes":565,"powershell_51_version":"5.1.26100.9444","powershell_7_synthetic_equal":true,"powershell_7_version":"7.6.5","powershell_byte":92,"powershell_sequence":"\\u0026","provenance":"CODEX_OBSERVED_SYNTHETIC_LOCAL_ONLY","python_byte":38,"python_synthetic_bytes":560,"root_cause":"WINDOWS_POWERSHELL_5_1_CONVERT_TO_JSON_HTML_ESCAPES_AMPERSAND_AS_BACKSLASH_U0026_PYTHON_DOES_NOT","scope":"DETERMINISTIC_SERIALIZER_DEFECT_REPRODUCTION_NOT_RECOVERY_OF_HISTORICAL_STDOUT"},"historical_original_limitation":{"disappearance_cause":"UNKNOWN","execution_time_comparison_recreated":false,"historical_evidence_recreated":false,"limitation":"RECORDED","present":false,"revalidation":"UNAVAILABLE"},"lifecycle":{"attempt_1":"FAIL_DURABLE_CAPTURE","attempt_2":"NOT_STARTED_PREPARED_FOR_SEPARATE_AUTHORIZATION","capture_correction":"PASS_CLOSED","durable_evidence":"NOT_PUBLISHED","independent_production_acceptance":"NOT_CLOSED","inspection_portion":"PASS_OPERATOR_SUPPLIED","pe4":"NOT_COMPLETE","phase7a":"ACTIVE","preparation":"PASS_CLOSED","projection":"DEFERRED","rollback":"NOT_PERFORMED","scheduler":"NOT_STARTED","second_adapter_execution_authorized":false},"negative_evidence_by_codex":{"acceptance_execution":false,"adapter_execution":false,"credential_access":false,"evidence_recreation":false,"ha_access":false,"old_evidence_directory_access":false,"pi3_access":false,"production_execution":false,"production_mutation":false,"reconciler_execution":false,"scheduler_mutation":false},"parent":"369134ff77d062ba0aeebc3db98e04662f2f6fed","record_type":"PE4_HA_ASSOCIATION_INDEPENDENT_ACCEPTANCE_CAPTURE_CORRECTION","retry_policy":{"attempt_2":"NOT_STARTED_PREPARED_FOR_SEPARATE_AUTHORIZATION","attempt_2_authorized":false,"automatic_retry":false,"basis":"PREPARATION_FORBIDS_AUTOMATIC_RETRY_NOT_SEPARATELY_REVIEWED_FRESH_READ_ONLY_ATTEMPT; SAME_INSPECTION_NO_ADAPTER_RERUN","old_run_reused":false,"sequence":["SOURCE_SYNC_CORRECTION_ONLY","STOP_INDEPENDENT_SOURCE_REVIEW","VALIDATE_WORKSTATION_CAPTURE_SECURITY_DURABILITY_SYNTHETICALLY","SEPARATE_ATTEMPT_2_AUTHORIZATION","NEW_EXCLUSIVE_RUN_CAPTURE_ORIGINAL_BYTES","STOP_INDEPENDENT_EVIDENCE_REVIEW"]},"schema_version":"1.0","sources":{"docs/HIOC_MASTER_PLAN.md":{"git_blob":"d5a567d476265f215510e127053d91ab66816f96","path":"docs/HIOC_MASTER_PLAN.md","sha256":"e79a651ab5912f484380c0e8f35329d5c3f220b30327b8634f503ecd41ca1833"},"governance/pe4/pe4-ha-association-durable-post-run-reconciliation-closure.json":{"git_blob":"08e0e4012185315b5bb801cf8cc68bb01eff5350","path":"governance/pe4/pe4-ha-association-durable-post-run-reconciliation-closure.json","sha256":"d5bf759331e95950bb5bc5a69310dfc502ffb67572fc363208c5c592fadfe983"},"governance/pe4/pe4-ha-association-independent-production-acceptance-preparation.json":{"git_blob":"d2d32ac29f579b7930795990d8d0db46dd048132","path":"governance/pe4/pe4-ha-association-independent-production-acceptance-preparation.json","sha256":"5187fd4fb18a18218e95b9c7732598738249296bfb9a9a23afdcdbd259bb16a8"},"governance/pe4/pe4-ha-association-independent-production-acceptance-preparation.schema.json":{"git_blob":"747152a9eabf331788070335ce277f675a048fd3","path":"governance/pe4/pe4-ha-association-independent-production-acceptance-preparation.schema.json","sha256":"119ba39cb4fc9902a38aec10ec82aca815e3e548cbe4fc3d322337e04e653ded"}},"starting_commit":"16b7dd412cde7503ea45c62734915096654aa690","starting_subject":"PE-4: prepare independent production acceptance","status":"PASS_CLOSED","workstation_helper":{"canonical_validation":"PYTHON_DUMPS_SORTED_COMPACT_ASCII_NO_NAN_LF_EQUALS_ORIGINAL_DUPLICATE_KEYS_REJECTED","credential_access":false,"durability":"FILE_FSYNC_AND_WINDOWS_DIRECTORY_FLUSH_REQUIRED_UNSUPPORTED_OR_FAILURE_FAILS_CLOSED_NO_FALLBACK","input":"EXACT_ORIGINAL_RECEIVED_STDOUT_ON_BINARY_STDIN_MAX4096_REMOTE_RETURN_CODE","interpreter":"LOCAL_WINDOWS_CPYTHON_3_12_OR_LATER_EXPLICIT_ABSOLUTE_EXECUTABLE_NO_PYTHONPATH_I_B","network_access":false,"new_acceptance_inspection_tool_required":false,"new_run":"NEW_EXCLUSIVE_TIMESTAMP_RANDOM_ID_UNDER_CORRECTION_COMMIT_SECURE_WINDOWS_EVIDENCE_PARENT_NO_REUSE","new_workstation_capture_harness_required":true,"path":"tools/hioc-pe4-ha-association-acceptance-capture.py","production_access":false,"publication":"ORIGINAL_VALIDATED_BYTES_ONLY_EXCLUSIVE_VALIDATION_FILE_THEN_SHA256_LENGTH_MANIFEST_LAST_FLUSH_REOPEN_NO_OVERWRITE","security":"NO_REPARSE_POINTS_OPERATOR_OWNED_PROTECTED_DACL_OPERATOR_SYSTEM_ADMINISTRATORS_ONLY; APPLY_DACL_ONLY_NEW_RUN","sha256":"a4e5895a8422f478486003300b4953be049548bbd79693366492f6ec6966d920","source_binding":"CLEAN_MAIN_HEAD_ORIGIN_EXACT_CORRECTION_COMMIT_DIRECT_PARENT_SUBJECT_HELPER_GIT_BYTES_NO_FETCH","stderr":"DISCARD_SSH_STDERR_DO_NOT_RETAIN_RAW_PRIVATE_ERRORS"}}
